Influencer,Hashtags,Post
sandbox848,"['#like', '#likeforlike', '#comment', '#followforfollowback', '#like', '#flowers', '#like', '#comment', '#like', '#likeforlike', '#comment', '#followforfollowback', '#like', '#flowers', '#like', '#comment', '#follow', '#follow', '#like', '#likeforlike', '#comment', '#followforfollowback', '#like', '#flowers', '#like', '#comment', '#follow', '#follow', '#love', '#food', '#instadaily', '#TFLers', '#tweegram', '#photooftheday', '#amazing', '#bestoftheday', '#instacool', '#instago', '#all', '#like', '#look', '#instalike', '#igers', '#follow', '#followme', '#follow', '#picoftheday', '#instafollow']",like forlike comment likes comments like forlike comment likes comments follow followback like forlike comment likes comments follow followback # likes shots like me follow
hap_fashion,"['#amazing', '#cute', '#perfect', '#instalove', '#inspiration', '#photooftheday', '#beauty', '#fashion', '#dress', '#photoofthenight', '#style', '#stylish', '#beautiful', '#girl', '#makeup', '#model', '#glam', '#glamorous', '#instaglamday', '#love', '#california', '#shoes', '#nails', '#highheels', '#girlfriend', '#swag', '#kimkardashian', '#picoftheday', '#taylorswift']",Cozy home Yes or No By myinteriorandhome orous friend
fisk_knives,['#class'],Matt contouring his handle on a small game knife during the weekend class jbs uaht school this weekend A VERY sharp cutter
medicen_juanfran,"['#chile', '#instachile', '#santiago', '#chilegram', '#instagood', '#instagram', '#photography', '#love', '#instalike', '#f', '#santiagodechile', '#photooftheday', '#like', '#picoftheday', '#model', '#happy', '#followme', '#selfie', '#photo', '#likeforlike', '#instadaily', '#fitness', '#instasantiago', '#follow', '#siguemeytesigo', '#tbt', '#likeforlikes', '#instastyle', '#art', '#chilean']",no s que escribir gram f dechile likes ollowme forlike itness ollow follow forlikes an
colin.strunk,[],Last night it was another Kings birthday romeforest It feels like we live in the suites
korean_movie20,"['#koreanactor', '#koreansinger', '#koreanfood', '#kdramer', '#kdramavideos', '#kdramaworld', '#parkbogum', '#parksodam', '#newdrama', '#itsokaynottobeokay', '#kimsoohyun', '#seoyeji', '#yooseungho', '#chaesoonbin', '#explorepage', '#explore', '#kdramavideos', '#kdramaworld', '#kdramakissscene', '#koreandramas', '#leeminho', '#kiss', '#love', '#kpop', '#clip', '#blackpink', '#howyiulikethat']",Music delbar janam Faryan record of youth tvN Netflix Park Bo Gum # # # # #
2faded._alireya,"['#explorepage', '#like', '#explore', '#follow', '#follow', '#asethetic', '#life', '#lifequotes', '#liveyourbestlife', '#edits', '#love', '#relationshipgoals', '#couples', '#couplegoals', '#feels', '#feelings', '#sad', '#depressed', '#moodtweets', '#mood', '#selfcare', '#selflove', '#viral', '#vibes', '#zodiacsigns', '#selflove', '#piscesmemes', '#brokenheart', '#earth', '#livinglife', '#relatable']",I really dk follow me faded alireya me quotes
norafatehi_iseverything,"['#follow', '#follow', '#chuvadeseguidores', '#likeforfollow', '#followforfollowback', '#chuvadelikes', '#seguidores', '#follower', '#memes', '#sdv', '#Love', '#bollywood', '#india', '#indianfood', '#morocco', '#korea', '#southkorea', '#follow', '#likeforfollow', '#follow', '#like', '#likesforlikesback', '#likeforlikes', '#like', '#likeforlikeback', '#f', '#l']",My Princess norafatehi I Hope you like my edit follow forfollowback er nfood followback k likes sforlikesback forlikes follow forlikeback f l
szaalonaaa,"['#selfiemoment', '#selfie', '#selfie', '#selfietime', '#me', '#mephoto', '#pozdrawiam', '#meselfie', '#memories', '#insta', '#instaphoto', '#instafashion', '#instagram', '#instasmile', '#smile', '#smileday', '#snapchat', '#love', '#lovely', '#girls', '#goodtime', '#like', '#nice', '#instaday', '#instahagstag', '#instagramers', '#hagstag']",# k time time photo selfie mories photo fashion gram smile day ly day hagstag gramers
henerik.sadiku,"['#cinematography', '#cinema', '#film', '#filmmaking', '#photography', '#movie', '#filmmaker', '#cinematographer', '#movies', '#cinematic', '#director', '#videography', '#art', '#films', '#actor', '#filmphotography', '#love', '#video', '#behindthescenes', '#directorofphotography', '#filmmakers', '#setlife', '#hollywood', '#cinephile', '#cine', '#photographer', '#filmproduction', '#videoproduction', '#instagood', '#bhfyp']",You keep dreaming and dark scheming Photoshot series with blanchenovembre making maker tographer s tic s photography ofphotography makers production production
kishdevents,"['#entertainment', '#virtualexperience', '#streaming', '#online', '#love', '#poetry', '#music']",Tonight I ve attended this Love Poetry Music event series a few times and it s always Streaming tonight as well as in person There s still good around
the.punpage,"['#puns', '#memes', '#punsdaily', '#memesdaily', '#memeoftheday', '#dankmemes', '#bestmemes', '#punny', '#punnyjokes', '#jokes', '#dadjokes', '#stupidjokes', '#funnyjokes', '#love', '#relationships', '#relationshipquotes', '#relationshipmemes', '#lovequotes', '#jokesforkids', '#comedy', '#funfacts', '#facts', '#awkward', '#cringe', '#funnyisfunny', '#humor', '#humour', '#bestjokes', '#punoftheday', '#pun']",I call my girlfriend a baby a lot But that s only because she s really short and has little tiny baby fingers Her middle finger is shorter than my pinky finger when she gets a large drink she has to hold it with two hands Funny thing is she s older than me and I call HER a baby Bit ironic isn t it FUN FACT The average relationship only lasts years and months according to graziadaily co uk We ll be going out years on Thursday What height are you I m and she s Is that a large height difference in your opinion I don t really think it is but some say it is the punpage the punpage the punpage Tags ignore daily daily jokes quotes forkids
saranj121,"['#interiordesign', '#the', '#designer', '#home', '#furniture', '#luxury', '#architecture', '#poshmark', '#rich', '#love', '#interior', '#fancy', '#fashion', '#beautiful', '#anonymous', '#style', '#family', '#life', '#beauty', '#amazing', '#creative', '#photography', '#gym']",Learn how to trade and earn using candle stick patternDm me for info
yasminescreation,"['#photography', '#camera', '#photooftheday', '#photo', '#love', '#instagood', '#nature', '#photographer', '#instagram']",September th Spiders coming our for spooky season grapher
rosee_gad,"['#beauty', '#like', '#me', '#makeupartist', '#make', '#follow', '#instagram', '#comment', '#followme', '#follow', '#like', '#followers', '#followme', '#followers', '#share', '#love', '#photography', '#insta', '#instagood', '#instamood', '#instadaily', '#instadaily', '#instalike']",Dbdoby likes me followback ers me ers good mood daily daily like
mango_toast_crafts,"['#mangoandtoast', '#miraclebeads', '#light', '#wow', '#love', '#colourful', '#gorgeous', '#bracelet']",A couple of photos a quick video to show you how miracle beads look a bit dull but then WOW when light hits them
youradminexpert,"['#family', '#grief', '#love', '#gwendolynlyoung', '#yourvirtualadminexpert', '#youradminexpert', '#onlinebusiness', '#womenwholead', '#womenwhohustle', '#girlganggoals', '#bossbabelife', '#onlinebusinessmanagement', '#coach', '#consultant', '#legacy', '#leadingbehindthescene']",Today is Josiah s st Birthday Party and my Auntie Tracy Flo Real Linyard Fleming isn t here to see her grandbaby her chocolate drop so I was glad I had a chance to see him today and whisper in his ear how much his Nana loved him We have a responsibility as family to stand in the gap IG Fam help me wish JoJo a Happy Birthday management
jacelya_jones,"['#justamom', '#out', '#for', '#a', '#date', '#and', '#costco', '#haul', '#married', '#life', '#love', '#fun', '#silly', '#selfcare']",I think it s totally normal for a date lunch to end up at Costco Don t you See more in my stories nd
budget_cosmetic_store,"['#cosmetics', '#beauty', '#makeup', '#skincare', '#makeupartist', '#Gurgaon', '#lipstick', '#fashion', '#mua', '#beautiful', '#instamakeup', '#eyeshadow', '#makeuplover', '#love', '#lashes', '#cosmetic', '#makeupaddict', '#skin', '#lips', '#makeuptutorial', '#like', '#skincareroutine', '#instabeauty', '#Hudabeauty', '#Mac', '#Combo', '#instagood', '#lipgloss']",Cheetah Hairband Rs DM or Whatsapp us for order and query NO COD available For booking and order take screenshots of the products and send us on whatsapp Online payment Account Transfer Google Pay Paytm accepted here artist lover addict tutorial routine
that.goldenpup,"['#thatgoldenpup', '#goldenretriever', '#mike', '#mikey', '#dogsofinstagram', '#goldenretrieversofinstagram', '#doglovers', '#dogloversofinstagram', '#puppiesofinstagram', '#puppylove', '#dogstagram', '#puppygram', '#follow', '#like', '#share', '#love', '#comment', '#instadog', '#dogsofinstaworld']",Do I look cute while sleeping Real answers y sofinstagram ofinstagram
rachele_raky_plebani,"['#comunione', '#inoneshot', '#myall', '#forever', '#three', '#zia', '#mamma', '#love', '#wonder', '#wondergirl', '#wonderwoman', '#follow', '#followme', '#followforfollows', '#followforlike', '#likeforfollows', '#likeforlikes', '#instamoment', '#instapic', '#instalove', '#instagood']",My All girl woman me forfollows forlike
thebeautydogformello,"['#thebeautydogformello', '#toelettatura', '#negozioperanimali', '#romanord', '#formello', '#zonaindustrialeformello', '#adorable', '#animal', '#animals', '#animallovers', '#cute', '#cutie', '#dog', '#dogs', '#doggy', '#dogoftheday', '#ilovemydog', '#life', '#love', '#loveit', '#pet', '#pets', '#nature', '#amore', '#instadog', '#dogofinstagram', '#spitz', '#spitzlover', '#spitzofinstagram', '#spitzlovers']",Leona Top Model s lovers s gy oftheday it s ofinstagram lover ofinstagram lovers
tiny_houses10,"['#crafts', '#etsy', '#handmade', '#reclaimedwood', '#interiors', '#cutepresent', '#smallbusiness', '#painted', '#artist', '#artandcraft', '#ornament', '#creative', '#design', '#cute', '#love', '#delicate', '#followme', '#craftblog', '#yellow', '#personalised', '#painting', '#pumpkin', '#halloween']",It s nearly pumpkin season
memesaddix,"['#meme', '#memes', '#funny', '#dankmemes', '#memesdaily', '#funnymemes', '#lol', '#follow', '#humor', '#dank', '#like', '#love', '#dankmeme', '#darkhumor', '#viralpost', '#follow', '#followformore', '#hilariousmemes', '#hilarious', '#amongusmemes', '#amongus', '#funnyshit', '#instagram', '#comedy', '#lmao', '#memepage', '#lol', '#fun', '#rekt']",HmMMm Help me hit k Follow memesaddix Follow memesaddix Follow memesaddix s sdaily memes meme e formore shit page
thepostednotes,"['#poetry', '#love', '#poet', '#art', '#poem', '#poetrycommunity', '#writersofinstagram', '#writer', '#poetsofinstagram', '#poems', '#writing', '#quotes', '#music', '#photography', '#life', '#artist', '#quote', '#words', '#instagood', '#spokenword', '#wordporn', '#hiphop', '#poets', '#inspiration', '#quoteoftheday', '#poetsofig', '#writersofig', '#writerscommunity', '#poetryofinstagram', '#motivation']",Conjunction community sofinstagram s ist s oftheday sofig sofig scommunity ofinstagram
jbd_surf,"['#savoie', '#waterfall', '#mountains', '#nature', '#bluesky', '#paysage', '#love', '#blue', '#color', '#beautiful', '#perfect', '#france', '#igers', '#photo', '#landscape', '#picoftheday', '#picture', '#igersfrance', '#blogger', '#followme', '#likeforfollow', '#travel', '#photography', '#photooftheday', '#photographer', '#lifestyle', '#view', '#instagood', '#instalike', '#blogger']",france explore graphy oftheday grapher
imrahul_ydv,"['#hindi', '#shayari', '#writings', '#poet', '#poetry', '#gulzar', '#gulzariyat', '#love', '#lovequotes', '#quotes', '#lifequotes', '#lifequotestagram', '#story', '#storywriting', '#writer', '#hindiquotes', '#writerscommunity']",ry poetry iyat quotes tagram writing quotes scommunity
nishxblogs,"['#nishxblogs', '#nishreviews', '#waterbottle', '#loveisland', '#healthy', '#muslim', '#hijabi', '#blogger', '#content', '#creator', '#peace', '#love', '#sprinklesofglitter']",This is legit the reason why I ve been drinking loads of water everyday it s just hella cute
shamkawsar,"['#mango', '#pickle', '#sweet', '#foodiesofinstagram', '#love', '#photography', '#cooking', '#cookingathome', '#cookingvideos', '#uk', '#london', '#photooftheday', '#video', '#garlic', '#Please']",athome videos Facebook Koli s KitchenPlease check this video on my YouTube channel Koli s kitchen CraftsLink on my profile like share subscribe my channel
asapchr420blow,"['#trapmusic', '#trapshit', '#gangshit', '#karikari', '#trapstars', '#instatrap', '#trap', '#musicaboa', '#musicas', '#bass', '#trapper', '#instamusic', '#musicvideo', '#s', '#love', '#quedateencasa', '#drummer', '#musical', '#os', '#moneymaker', '#singer', '#viol', '#violino', '#musicabrasileira', '#drill', '#sico', '#musiclovers', '#musicist', '#like', '#pysco']",ASAP CHRThree now songsStill workingSuscribanse yeahBlessingsTRAPLP TRAPBOLIVIA JUSTU FLEX per inger ino ico
themajorarcana,"['#blackgirlmagic', '#africanamerican', '#love', '#blackpanther', '#fun', '#history', '#queen', '#royal', '#share']",A F R I C A N A M E R I C A N We went from kings and queens to slaves to kings and queens again Because it s in our DNA Okay so all my good footage of this video I deleted by accident and I wasn t about to do this all over so ignore the nip slip long pauses and bad editing ima make it work with this also yes I know I lost a lot of weight on the vegan diet so don t start lol BUT I AM MAJOR so now that I m back in the gym it s a wrap
relatablebih,"['#relationshipgoals', '#relatable', '#comedy', '#funny', '#vine', '#tiktok', '#laugh', '#relax', '#smile', '#travel', '#photography', '#love', '#truelove', '#explore', '#explorepage', '#likeforlikes', '#followforfollowback', '#followme']",i m glad i m bot the only ine who does this cc curtdoggfollow relatablebih for more page
jakyboutros,"['#missyou', '#missingyou', '#me', '#and', '#him', '#love', '#around', '#lovequotes', '#like', '#like', '#likeforlikes', '#photo', '#photolike', '#photograph', '#photooftheday', '#photographer', '#instagood', '#instamood', '#instalove', '#instafun', '#instalook', '#instalike', '#instabeauty', '#instapic', '#instaphoto', '#insta', '#LEBANON', '#livelovelebanon', '#ilovelebanon']",Years from now our past will be a story A story of long days and lonely nights hard work and lack of sleep Being apart we ll appreciate and embrace our time together knowing how lucky we are to have made it through and we ll find solace in the promise ot a future together # quotes like forlikes like graph oftheday grapher lebanon
shopsohermosa,"['#explorepageready', '#gainwithmchina', '#gains', '#tembeakenya', '#gainwithspikes', '#black', '#explorepage', '#igerskenya', '#gainwithxtiandela', '#explore', '#love', '#gainwithbundi', '#nakuru', '#gainwithpaula', '#madeinkenya', '#nairobikenya', '#publicity', '#babamaxii', '#iamnairobian', '#gainreallfollowerssquad', '#gaintrick', '#watapatatabusana', '#igkenya', '#followforfollowback', '#wiztom', '#omegalivetv', '#follow', '#hyperbeast', '#let']",Shop Madiz Party Dress SHOP NOW Link In Bio shopsohermosa www sohermosa com # over
princesskenny3,"['#followme', '#likeforlike', '#like', '#follow', '#followforfollow', '#f', '#gainwithbundi', '#gainwithmchina', '#love', '#gainwithmchina', '#explorepages', '#explore', '#explorepage', '#instadaily', '#photooftheday', '#instagood', '#igers', '#picoftheday', '#nofilter', '#bestoftheday', '#watapatatabusana', '#exploremore', '#gainwithxtiandela', '#gainwithbundi', '#nakuru', '#tembeakenya', '#gainwithpaula', '#gainwithspikes']",bayano classic will get will get you k followers in weeks Let s make you a celebrity with real fans following you fast speedy followers Read my bio bayano classic is amazing like follow forfollow f page more
yasmine__cadeaux,"['#cadeau', '#gift', '#handmade', '#love', '#ideecadeau', '#noel', '#faitmain', '#baby', '#madeinfrance', '#cadeaux', '#bijoux', '#bebe', '#amour', '#kado', '#b', '#fashion', '#babyshower', '#concours', '#christmas', '#anniversaire', '#cadeautip', '#decoration', '#deco']",x shower tip # # # # #
lgbtita_,"['#lgbtq', '#lgbtpride', '#lgbtq', '#lgbt', '#lgbtartwork', '#lgtbi', '#lgbtitalia', '#pridemonth', '#pride', '#pride', '#pride', '#lgbt', '#italialgbt', '#loveislove', '#loved', '#lesbian', '#gay', '#bisex', '#bisessuale', '#lesbica', '#gay', '#amore', '#amati', '#pride', '#pride', '#prideitalia', '#pridetorino', '#prideturin', '#pride', '#asexual', '#asessuale', '#LGBTQ', '#love', '#loveislove', '#amiamoci', '#loved']",le belle idee per i meme mi vengono ogni anni HAHAHAHcool meme ideas come to me every years HAHAHHA artwork italia amore italia torino turin
mikal_mkali,[],Walls are meant to express not to hide and repress
marilena.eck,[],Show no emotion and it can destroy your soul
velvetskies.photography,"['#dogs', '#dogphotography', '#petphotography', '#canon', '#canonphotography', '#lightroom', '#love', '#dogsofinstagram', '#pets', '#doggo', '#dogsrule', '#ilovedogs', '#petsofinstagram', '#retrievers', '#retrieversofinstagram', '#goldenretriver', '#retrievermix', '#tripod', '#tripoddog', '#petsitter', '#petsitterlife', '#canon']",Do these glasses make my head look big Reagan photography ofinstagram rule ofinstagram ofinstagram dog itter itterlife d
annasanz10,"['#fitnessgirl', '#javea', '#beach', '#summer', '#bootygains', '#friends', '#alwaysstrong', '#freenipples', '#love']",The best team
mr__sam86,"['#likeforfollow', '#likeforlikes', '#gaintrain', '#gaintrick', '#sdvtodos', '#sdv', '#gainwithcarlz', '#gainwithmchina', '#gainparty', '#followtrain', '#chuvadelikes', '#baghieworld', '#kerala', '#india', '#malyalam', '#mallu', '#kochi', '#photography', '#love', '#keralagram', '#instagram', '#godsowncountry', '#keralatourism', '#gainwithbaghie', '#malyali', '#gerrybruh', '#keralagodsowncountry', '#kozhicode']",# # likes gram tourism godsowncountry
