Influencer,Hashtags,Post
petitecrumb,"['#picoftheday', '#pastrychef', '#brisbanecakes', '#instacake', '#foodporn', '#brisbane', '#brisbanefood', '#cakedecorator', '#layercake', '#love', '#bake', '#instaeats', '#cakesituation', '#hungry', '#fridgesituation', '#bne', '#kitchenaidausnz', '#cupcakes', '#brisbaneflowers']",Pretty floral cupcakes food flowers
staysaltyflorida,"['#staysaltyflorida', '#staysalty', '#florida', '#floridalife', '#loveflorida', '#visitflorida', '#sunshinestate', '#beach', '#beachlife', '#beachbabe', '#beachdays', '#springbreak', '#photooftheday', '#bestshot', '#picoftheday', '#pureflorida', '#saltlife', '#love', '#hey', '#emeraldcoast', '#shiplap', '#porch']",If you re lucky enough to live by the beach you re lucky enough Grayton Beach F L R D A Photo Cred avacay life life babe days # a a
adechivu,['#love'],How to resist cristianchivu
esma.23,"['#esma', '#hallstatt', '#travel', '#clouds', '#sunset', '#love', '#amazing', '#landscape', '#beautiful', '#esma', '#travelphotography', '#nationalgeographic', '#landscape', '#awesomeearth', '#flowers', '#naturephotography', '#mountains', '#magicpict', '#japan', '#photographysouls', '#nature', '#agameoftones', '#landscapephotography', '#flowers', '#photographyislife', '#photographylover', '#natgeo', '#photographyislifee', '#photooftheday', '#colorful', '#earthpix', '#travelawesome']",Photo by esma photography lovers perfection photography e awesome
tiagomaravilha,"['#photooftheday', '#vsco', '#vscocam', '#instadaily', '#insta', '#iger', '#igersportugal', '#portugal', '#portugal', '#portugaldenorteasul', '#instamood', '#porto', '#village', '#huawei', '#animals', '#dog', '#dogoftheday', '#dogstagram', '#naturephotography', '#naturephotography', '#sun', '#music', '#idontcare', '#love', '#instamood', '#instagood', '#animal', '#lovely']",cam sportugal lovers denorteasul mood oftheday stagram mood good ly
ade_gaintrain,"['#nigerianwedding', '#love', '#abuja', '#african', '#naijacelebrity', '#brodashaggi', '#owambe', '#kaduna', '#naijacomedy', '#funny', '#ade', '#instagram', '#lagosfashion', '#enugu', '#repost', '#arewa', '#lindaikeji', '#nigerians', '#ikoyi', '#warri', '#ibadan', '#krakstv', '#instablog', '#naijafashionista', '#comedy', '#followforfollow', '#naijawedding', '#naijabusiness', '#hustlesquare', '#unilag']",DO YOU WANT TO GAIN MASSIVELY COMMENT AS MUCH AS YOU CAN FOLLOW ALL THE HANDLES IN THE COMMENT SECTION AND REQUEST FOR A FOLLOW BACK TURN ON MY POST NOTIFICATION FOLLOW THE CREATOR ade gaintrain ade gaintrain ade gaintrain ade gaintrain ade gaintrain ade gaintrain ade gaintrain ade gaintrain Follow the handle below to gain more ade gaintrain backup ade gaintrain backup ade gaintrain backup ade gaintrain backup ade gaintrain backup ade gaintrain backup gaintrain
the_happy_boho_vegan,"['#furbabies', '#luna', '#midnight', '#love', '#catsofinstagram', '#tortiesofinstagram', '#blackcatsofinstagram']",Luna absolutely loves Middy and for anyone who knows Middy she doesn t let many people like her or even look at her or breathe the same air lolShe would let Luna sit on her if Luna wanted to sure she thinks she s her mum
soph004,"['#love', '#missher']",Could of called my Nan my twin
valentina_fonseca_oficialarg,"['#follow', '#ladylavendedoraderosas', '#ladylavendedorasderosas', '#sinsenossihayparsiso', '#sinsenosihayparaiso', '#sinsenoss', '#teamo', '#sinsenossihay', '#sinsenossihayparsiso', '#sinsenosnohayparaiso', '#sinsenoss', '#sinsenosihayparaiso', '#instainfluencer', '#publicotucuenta', '#brasil', '#love', '#seguidores', '#seguidores', '#sinsenossihayparaiso', '#sinsenossihay', '#sinsenossihaypara', '#sinsenossihayparaiso', '#sinsenossihayparaiso', '#sinsenossihaypara', '#ssshp']",La history de arenasjennifer clarissashop us sigueme valentina fonseca oficialar k haypara so ihay yes haypara so # no instaaihayparaiso ihayihaypara so ihayparaisoihayparaiso ihaypara so
status.dz17,"['#quotes', '#workout', '#earthfocus', '#roses', '#yamaha', '#tiktok', '#usa', '#instagood', '#instagram', '#algerienne', '#love', '#kpop', '#nails', '#japan', '#art', '#drawing', '#happy', '#flowers', '#paris', '#beautiful', '#vintage', '#girl', '#ootd', '#style', '#lifestyle', '#moda', '#igers', '#xbox', '#zara', '#kuwait']",cristiano ayoya zed zidane soolkingofficiel riyadmahrez merouane guerouabi hichem dn djalil palermo fn djalil palermo hichem smati official faycal mignon officiel
jay_retro5,"['#explore', '#views', '#Singer', '#rapper', '#songwriter', '#music', '#song', '#musican', '#views', '#hiphop', '#Rap', '#RnB', '#pop', '#sing', '#follow', '#follow', '#youtube', '#youtuber', '#rapping', '#GainPost', '#GainTrick', '#soundcloud', '#soundcloudrapper', '#likeforlikes', '#comment', '#love']",Thinking about dropping this soon UNIVERSE Here s a little snippet of the beat that goes to it NEW MUSIC COMING VERY SOON an # follow r rapper
jhay_fleek,"['#followme', '#likeforlike', '#like', '#follow', '#followforfollow', '#f', '#gainwithbundi', '#gainwithmchina', '#love', '#gainwithmchina', '#explorepages', '#explore', '#explorepage', '#instadaily', '#photooftheday', '#instagood', '#igers', '#picoftheday', '#nofilter', '#bestoftheday', '#watapatatabusana', '#exploremore', '#gainwithxtiandela', '#gainwithbundi', '#nakuru', '#tembeakenya', '#gainwithpaula', '#gainwithspikes']",bayano classic will get you k followers in weeks Let s make you a celebrity with real fans following you fast speedy followers Read my bio bayano classic is amazing like follow forfollow f page more
maha_sketch,"['#art', '#drawing', '#draw', '#artisy', '#mood', '#shootgun', '#pencilcolor', '#creative', '#famousart', '#from', '#features', '#artfeaturing', '#account', '#daily', '#fanart', '#quickdrawing', '#beauty', '#artoftheday', '#sketch', '#blackart', '#pencile', '#dotwork', '#myart', '#sketching', '#howtodraw', '#artgallery', '#style', '#love', '#gooddaygoals']",isy # featuring oftheday ing gallery
queenofsummmer,"['#mygarden', '#myflowers', '#flowers', '#flowersofinstagram', '#poetry', '#beautiful', '#poetry', '#magic', '#romance', '#instadaily', '#instapic', '#photography', '#flowergirl', '#naturelovers', '#photographer', '#naturephotography', '#picoftheday', '#garden', '#gardner', '#nurture', '#blooms', '#entrepreneur', '#urdupoetry', '#travelgram', '#selflove', '#love', '#summer', '#romantic', '#naturephotography', '#nature', '#dreamer', '#passion']",All flowers critters on this page are from my garden Blessed by the divine powers magic of the Sun Earth Sky Air the mesmerizing Rains Enjoy my lovelies Pretty Dragon Fly Lady in Red ofinstagram
murphy_quinn_the_hearty_havi,"['#grandpaw', '#grandpawrents', '#havanese', '#havaneseofinstagram', '#havaneselove', '#havi', '#doggo', '#doggosofinstagram', '#love', '#dogsofinstagram', '#smalldogsofinstagram', '#smalldoglife', '#dogmom', '#doggylove', '#doggram', '#outdoordogadventures', '#saturdayvibes', '#saturday', '#weekendvibes']",I really really really LOVE my Grand paw and mom says he secretly loves me too rents ofinstagram love sofinstagram
_szandyart_,"['#love', '#specialart', '#art', '#artwork', '#chibiart', '#chibi', '#ownstyle', '#me', '#cute', '#bunny', '#loveyouall', '#heart', '#happy']",Hello everyone We did it guys We reached followers and it s really mean to me a looot like I was so unsure about to create this page I thought nobody would actually interested in my drawings But you showed me that I was wrong I met amazing ppl who supported me from the begining like szalay zsolt izzys hobby art dinoxwave phoenixx art I am sure bout that without all of u I wouldn t do it Thank you Not from the beggining but these ppl supported me a lot and I can t thank this enough lika drawings antinav jackalwicked paladinsartco raul sousa Thank you And all the amazing ppl who showed me that my works are actually worth to follow This little chibi me is my gift for all of my followers Enjoy it and have a nice evening # followers work youall
fotog.a,"['#naturaleza', '#nature', '#photography', '#spain', '#naturephotography', '#landscape', '#travel', '#costadelsol', '#photooftheday', '#picoftheday', '#naturelovers', '#love', '#paisaje', '#monta', '#instagood', '#photo', '#mountain', '#fotografia', '#natura', '#mountains', '#beach', '#sky', '#photographer', '#travelphotography', '#landscapephotography', '#flowers', '#paisajes', '#beautiful', '#mar', '#sunset']",Ufff muy solitaria photography lovers a s grapher photography photography s
razi__mechti,"['#followme', '#like', '#TFLers', '#liker', '#likes', '#likes', '#photooftheday', '#love', '#likeforlike', '#likesforlikes', '#liketeam', '#likeback', '#likebackteam', '#instagood', '#likeall', '#likealways', '#liking', '#liked', '#follow', '#f', '#followme', '#TFLers', '#followforfollow', '#follow', '#teamfollowback', '#followher', '#followbackteam']",like r s # s likes forlike sforlikes team back backteam all always d f forfollow follow her backteam
yessicamoreno,"['#Repost', '#thalia', '#thaliasodi', '#emperatrizdelabelleza', '#reinadelpoplatino', '#thequeenoflatinpop', '#thaliaamoremio', '#thaliavaliente', '#thalialatina', '#marimar', '#rosalinda', '#marialadelbarrio', '#mariamercedes', '#love', '#follow', '#repost', '#followforfollowback', '#thalialaantigua', '#thaliaretro', '#thaliathelegend', '#soyfanyque', '#thalifans', '#amoralamexicana', '#thaliasodicollection', '#thaliareinadelpoplatino', '#beautiful', '#adriabythalia', '#diva', '#thalialegacy']",from pauliathalifans Perfecta thalia sodi amoremio valiente latina forfollowback laantigua retro thelegend sodicollection reinadelpoplatino legacy
binz_vv,"['#byo', '#chriscunningham', '#anime', '#robots', '#director', '#cyberpunk', '#music', '#love', '#visualart', '#robotlove', '#design']",Searching for some new inspiration by looking at back at the last All is full of love one of the most iconic videos of all time rk
jessibianca,"['#love', '#happiness', '#inlove', '#perfect', '#mylove', '#themenofmylife', '#perfectmatch', '#couplegoals', '#imallyours', '#justhisgirl', '#loveofmylife', '#willneverletyougo', '#thankful', '#greatful', '#i', '#mymen']",Never thought that I will meet my soulmate one day I was giving up of being with or finding the men of my life I wanted to start concentrate on myself and my life And than suddenly I met this amazing men There was such a big connection between us Even if I didn t wanted to be with someone I knew pretty soon that he s the men of my life I ve never felt so happy in my life finally I feel complete I m so thankful that I met this men and that I can call him my men thank you so much and I love you more than words could ever say match ofmylife you
ciudadesatinta,"['#bar', '#details', '#art', '#artist', '#happiness', '#architect', '#me', '#colors', '#painting', '#arteverywhere', '#artwork', '#mural', '#murals', '#nature', '#sprayart', '#beautiful', '#naturist', '#love', '#arte', '#artwall', '#muralesdecorativos', '#intervencio', '#photography', '#streetartist', '#create', '#passion', '#passion', '#muralpainting', '#colores', '#happy']",ist everywhere work s e wall esdecorativos n painting
dogs_planet0,"['#dog', '#dogsofinstagram', '#dogs', '#puppy', '#dogstagram', '#instadog', '#doglover', '#love', '#dogoftheday', '#pet', '#doglovers', '#doglife', '#cute', '#puppylove', '#instagram', '#pets', '#puppiesofinstagram', '#doggo', '#of', '#puppies', '#dogsofinsta', '#cat', '#ilovemydog', '#animals', '#petsofinstagram', '#hund', '#petstagram', '#doglove', '#dogphotography', '#doglife']",Pumpkin princesses Double tap Follow us for more cute dogs and puppies pictures and videos dogs planet Send us your dog pic to post it sofinstagram s stagram lover oftheday lovers life love s go sofinsta sofinstagram stagram love photography life
babblesngiggles2,"['#newbusiness', '#smallbusiness', '#business', '#startup', '#entrepreneur', '#supportsmallbusiness', '#handmade', '#businessowner', '#smallbusinessowner', '#localbusiness', '#newbusinessowner', '#blackownedbusiness', '#love', '#startupbusiness', '#fashion', '#marketing', '#shopsmall', '#entrepreneurship', '#supportlocal', '#explorepage', '#follow', '#shoplocal', '#design', '#businesstips', '#womeninbusiness', '#comingsoon', '#motivation', '#branding', '#businesswoman', '#bhfyp']",COMING SOON We are busy adding products to our brand new business which we are very excited about and can t wait to welcome everyone owner owner owner business ship tips woman
zoey_snowyy,"['#nature', '#photography', '#naturephotography', '#love', '#photooftheday', '#travel', '#instagood', '#beautiful', '#picoftheday', '#art', '#instagram', '#photo', '#landscape', '#naturelovers', '#like', '#follow', '#bhfyp', '#ig', '#travelphotography', '#happy', '#life', '#summer', '#sunset', '#flowers', '#beauty', '#wildlife', '#sky', '#instadaily', '#photographer', '#bhfyp']",took this photo today Tags photography lovers photography grapher
_new__time__,"['#people', '#peoplescreative', '#smile', '#home', '#liketime', '#likeforlikes', '#like', '#lik', '#like', '#likeme', '#likers', '#likeinsta', '#fotografia', '#foto', '#fotos', '#music', '#musicvideo', '#mylife', '#musik', '#mybabies', '#mygirl', '#myfriend', '#myfavorite', '#foto', '#like', '#likers', '#post', '#newpost', '#live', '#love', '#mylife', '#mylook']",screative likes follow me rs insta s video rs
the.flashtrfan,"['#barryallenedits', '#barryallen', '#barryallenedit', '#the', '#flash', '#theflash', '#theflashedits', '#theflashedit', '#theflashcw', '#cw', '#cwtheflash', '#dc', '#dccomics', '#dcfandome', '#dcuniverse', '#dcseries', '#comics', '#comic', '#comiccon', '#comicbooks', '#comicart', '#love', '#like', '#comment', '#share', '#save']",Such a cute grantgust cavanaghtom edit flash flashedits flashedit flashcw theflash comics fandome universe series con books art #
q8am93_official,"['#kuwait', '#kuwaitcity', '#q', '#dubai', '#like', '#love', '#kuwait']",# # # city # # # # # # # # # # # # # # # # # # # #
booksby_bri,[],M I N D R E A D I N G So I ve been resisting the urge to buy fall themed candles because a I don t have a lot of money to spend on frivolous things and b I still have plenty of other candles that I need to burn before I replenish my stock Why can t I be this responsible when I m at a bookstore ANYWAY Imagine my delight when my Scribbler box included this beauty The scent is a bit stronger than I think I would have chosen if I d gotten it at the store but beggars can t be choosers Shoutout to goscribbler and novellyyours
minimax95,"['#followme', '#likeforlike', '#like', '#follow', '#followforfollow', '#f', '#gainwithbundi', '#gainwithmchina', '#love', '#gainwithmchina', '#explorepages', '#explore', '#explorepage', '#instadaily', '#photooftheday', '#instagood', '#igers', '#picoftheday', '#nofilter', '#bestoftheday', '#watapatatabusana', '#exploremore', '#gainwithxtiandela', '#gainwithbundi', '#nakuru', '#tembeakenya', '#gainwithpaula', '#gainwithspikes']",bayano classic will get will get you k followers in weeks Let s make you a celebrity with real fans following you fast speedy followers Read my bio bayano classic is amazing like follow forfollow f page more
acbcota,[],HEAVY GRACE for lucysmagazine September s issue PH fredericcosantos STYLING by me acbcota MUA beatriz texugo HAIR edgarvenanciohairstylist with pasteldechata from justmodelslisbon
giovannitawfik,['#giovannitawfik'],F A
dhanis_blog,"['#quoteoftheday', '#quotestoliveby', '#quotes', '#motivationalmonday', '#instaquote', '#qotd', '#motivation', '#MondayMotivation', '#motivationalquotes', '#inspiration', '#motivation', '#lifequotes', '#love', '#writersofInstagram', '#success', '#wordsofwisdom', '#positivevibes', '#thoughts', '#lovequotes', '#life', '#instagood', '#lifestyle', '#successquotes', '#positivequotes', '#dailyquotes', '#loveyourself', '#quotesdaily', '#positivity', '#quotesaboutlife']",Don t stop until your proud alquotes quotes # words style quotes yourself daily aboutlife
ryan_nikohl,[],You re my favorite pumpkin from the patch
melisasofiacifci,"['#dutchmodel', '#model', '#dutch', '#portrait', '#photoshoot', '#modeling', '#fashion', '#kidsmodel', '#portraits', '#dutchmodelsupport', '#modellife', '#fashionmodel', '#photography', '#ig', '#dutchmodels', '#internationalmodel', '#childmodel', '#kindmodel', '#models', '#modelling', '#dutchphotographer', '#photooftheday', '#shoot', '#modelphotography', '#fashiongirl', '#beauty', '#fotoshoot', '#scoutme', '#amsterdam', '#rotterdam']",Melisa for nolabelskidswear AW ing s support life model s s ling photographer photography girl
nikolaal1,[],Put me in a room with the same people who talk shit about me and watch how friendly they become
eliran__maman,"['#style', '#profile', '#me', '#ramatgan', '#israel', '#gay', '#sn', '#lovemen', '#tiktok', '#lovesnapchat', '#snapgay', '#gayhot', '#gayboy', '#love', '#bedroom', '#selfie', '#tlvgay', '#tlv', '#sun', '#summer', '#gaysofinstagram', '#gaylife', '#sexygay', '#gayman', '#Fun', '#inbed', '#isragay', '#telaviv', '#dog']",pchat apgay hot boy sofinstagram life man
domenikadorothea,"['#beauty', '#portrait', '#portraitmood', '#bnwportraits', '#bnwphoto', '#love', '#bnw', '#shots', '#loveportraits', '#portrait', '#model', '#modeling', '#sweden']",Model Agnes Hallin Agency BeautyModelmanagement mood portraits shots ing
ai_o_mitsukeru,"['#love', '#drawinglove', '#art', '#animeart', '#manga', '#mangaart', '#mangadrawing', '#animedrawing', '#drawing', '#sketch', '#sketching', '#artist', '#artistic', '#reference', '#artreference', '#drawingreference', '#howto', '#howtodraw', '#creativity', '#pencil', '#watercolor', '#watercolorpainting', '#aquarelle', '#painting', '#oilpainting', '#acrylicpainting', '#artoftheday']",Every now and then they tell me that my head is somewhere else I think I am among the stars # art drawing ing ist istic reference reference draw painting oftheday # #
masis_world,"['#art', '#artwork', '#instaart', '#creative', '#instagood', '#followme', '#artist', '#drawing', '#picoftheday', '#colorful', '#dominicanartist', '#artlover', '#artlove', '#beautiful', '#smile', '#pictureoftheday', '#color', '#bird', '#artistsoninstagram', '#colors', '#lips', '#me', '#love', '#create', '#trippy', '#artstudio', '#artoftheday', '#artlovers', '#trippyart', '#artsy']",FOR SALE DM ME IF INTERESTED FOR COLORING PAGESART MERCHMY ART STUDIO TOURPRINTSJEWELRYCOMMISSIONS ETC VISIT linktr ee RandomnezStudio work ist lover love istsoninstagram s studio oftheday lovers art sy SUPPORT ME ON PATREON Patreon com randomnezBeautiful Chaos
michel.longoria,"['#instaboy', '#instamood', '#gay', '#gaylife', '#gaymen', '#instagood', '#gayboy', '#loveyourself', '#gayguy', '#selfie', '#boy', '#picoftheday', '#gayteen', '#queer', '#instagramer', '#lgbt', '#emoboy', '#instagay', '#instafit', '#instame', '#happy', '#instapic', '#instalove', '#loveislove', '#instalike', '#smile', '#me', '#followers', '#love', '#cute']",If I die young bury me in satin lay me down on a bed of roses sink me in the river at dawn send me away with the words of a love song life men boy guy teen
misscaro225,"['#me', '#french', '#parisienne', '#Paris', '#BlackGirl', '#BlackandWhite', '#blackisbeautiful', '#prettygirl', '#photo', '#Love', '#newhair', '#selfie', '#red', '#rouge', '#soleil', '#tressesafricaines', '#regardperc', '#piercingeyes', '#smile', '#sourire', '#braidsred', '#braids', '#style', '#Disneylandparis', '#disney', '#l', '#follow', '#tagsforlikes', '#Snapchat', '#iphone']",NEW HAIR BRAID BOX RED SUN SOLEIL SHOOT REGARD PERC ANT PIERCING EYES SMILE SOURIRE LE FLOW STYLE DOPE LOVES yesterday IG ant l follow on s
threadsnext,"['#selfcare', '#selflove', '#skincare', '#selfhelp', '#selfcaretips', '#skincaretips', '#tips', '#skincareroutine', '#selfcarethreads', '#threads', '#skincarelover', '#selfcarematters', '#makeup', '#girlpower', '#love', '#girllove', '#lgbtq', '#confessions', '#memes', '#relatabletweets', '#tweets', '#aesthetic']",Follow threadsnext for more threadsBy frxstedthreads tips tips routine threads lover matters
dmc.fmscents,"['#fm', '#fmworld', '#fmuk', '#mini', '#perfume', '#love', '#treatyourself']",How cute are these mini bottles perfect size for your handbag world uk
julietronx3,"['#babygirl', '#mamasgirl', '#sully', '#baby', '#monstersinc', '#pumpkinspiceandeverythingnice', '#pumpkinspice', '#fall', '#bowhead', '#fallfashion', '#love', '#happy', '#smile', '#blueeyes', '#socute', '#inlove', '#happybaby']",When mama surprises you with a buddy for photos swipe to see her adorable reaction to sully Ofc we had to great our friend with kisses I love how animated she is getting fashion baby
keelas_world,"['#fitlife', '#conquer', '#yourself', '#mental', '#weightloss', '#mindset', '#becomebetter', '#dontquit', '#workout', '#body', '#weightlifting', '#fitfam', '#fitness', '#inspiration', '#everyday', '#fitnessaddict', '#transformation', '#life', '#bodybuildingcom', '#selflove', '#motivation', '#fit', '#love', '#attitude', '#flex', '#selfdiscipline', '#you']",Mindset # upnutrition # uptransformationchallenge addict buildingcom #
sane_writer0197,"['#instadaily', '#instagood', '#instamood', '#instalikes', '#picoftheday', '#smile', '#me', '#happy', '#follow', '#followforfollowback', '#likeforlikes', '#writingcommunity', '#writers', '#hindi', '#shayari', '#poemsporn', '#amateurwriter', '#writersofinstagram', '#lockdown', '#quoteoftheday', '#quotes', '#lockdown', '#love', '#confessions', '#supportlocal', '#artistsoninstagram', '#web', '#writer', '#hindipoetry', '#tinytales']",forfollowback ofinstagram poetry
iamhotlamborghini,"['#followme', '#likeforlike', '#like', '#follow', '#followforfollow', '#f', '#gainwithbundi', '#gainwithmchina', '#love', '#gainwithmchina', '#explorepages', '#explore', '#explorepage', '#instadaily', '#photooftheday', '#instagood', '#igers', '#picoftheday', '#nofilter', '#bestoftheday', '#watapatatabusana', '#exploremore', '#gainwithxtiandela', '#gainwithbundi', '#nakuru', '#tembeakenya', '#gainwithpaula', '#gainwithspikes']",bayano classic will get you k followers in weeks Let s make you a celebrity with real fans following you fast speedy followers Read my bio bayano classic is amazing like follow forfollow f page more
courtneyharperx,"['#celebration', '#celebrate', '#wedding', '#zoomwedding', '#mylove', '#love', '#meninkilts', '#dreamy', '#lockdownlife']",Me and my number fan
babyloismia,"['#girlinred', '#editaudios', '#strangerthings', '#tiktok', '#october', '#makeup', '#wefellinloveinoctober', '#love', '#edit', '#vsp', '#vs', '#videostar', '#tiktok', '#lfl', '#fff', '#addisonrae', '#charlidamelio', '#feature', '#omgpage', '#winter', '#quotes', '#selfcare', '#skincare', '#poems', '#songs', '#billieeilish', '#arianagrande', '#riverdale']",We all hope your ok Lois Your amazing and we will always be here for you no matter what You can count on us and if you ever need anything we re always going to be active in the group chat stay safe we love you you ll get thru this ac audiossofts dt loismia x et hrs m cp xeuqhoric
kalyankar_shoutout_,"['#model', '#fashion', '#photography', '#love', '#style', '#instagood', '#photooftheday', '#beauty', '#like', '#instagram', '#beautiful', '#follow', '#art', '#photo', '#portrait', '#photoshoot', '#cute', '#picoftheday', '#myself', '#girl', '#modeling', '#smile', '#me', '#photographer', '#makeup', '#happy', '#likeforlikes', '#selfie', '#bhfyp', '#bhfyp']",shoot ing grapher forlikes
the_shoppe1,"['#onlineshopping', '#fashion', '#onlineshop', '#shopping', '#style', '#online', '#onlinestore', '#onlineboutique', '#instafashion', '#ootd', '#fashionblogger', '#shoppingonline', '#love', '#fashionista', '#instagood', '#sale', '#like', '#shop', '#instagram', '#follow', '#shoponline', '#accessories', '#dress', '#handmade', '#shoes', '#beauty', '#fashionstyle', '#shoplocal', '#boutique', '#bhfyp']",Kurta Fabric RayonBottomwear Fabric RayonFabric RayonSet Type Kurta With Dupatta And BottomwearBottom Type PantsPattern PrintedMultipack SingleSizes XL Bust Size in Kurta Length Size in Duppatta Length Size m L Bust Size in Kurta Length Size in Duppatta Length Size m XXL Bust Size in Kurta Length Size in Duppatta Length Size m M Bust Size in Kurta Length Size in Duppatta Length Size m Sizes Available M L XL XXL store boutique blogger online ista online style local
psychicsavanna,"['#love', '#Energyhealing', '#newyorkcity', '#NewJersey', '#Selflove', '#Selfcare', '#Clairvoyant', '#love', '#Energyhealing', '#Harrison', '#Spiritualadvisor', '#Loveyourself', '#relationship', '#Marriage', '#free', '#help', '#Lifecoach', '#Guidance', '#help', '#Anxiety', '#Happiness', '#Business', '#money', '#chakracleansing', '#chakrabalancing']",Fall special Call Psychic Readings By Savanna Have You Been Wandering If He She Is Right For You Stressed and confused about many things Well stop worrying No Problem Is To Small Or To Big For Me I Have Helped Many People All Aound The World No Matter What The Situation May Be Contact psychic savanna by DM to And Book Your Reading today New York New Jersey psychic gifted and master in love Business owner in Harrison New Jersey Experience over years Contact psychic savanna DM To Get Your Reading Today Need clarity answers peace of mind and comfort Feel free to call savanna for a relaxed and understanding session Thank you and stay safe psychicSavanna All readings off DM for more info psychicSavanna # hourpsychic
_vishesh_,"['#HusbandAndWife', '#Love', '#Sweet', '#MarriedLife', '#Happy', '#Couple', '#Memories', '#Pic', '#Throwback']",WeddingAnniversary th #
lilly_books_,"['#cutekitten', '#kittensofinstagram', '#sweetcat', '#pawsome', '#paws', '#pawsup', '#animal', '#animallove', '#love', '#lovecats', '#catlove', '#specialkitten', '#cutecats']",Little cupcake up love cats
